{
  "artifact_bindings": {
    "universal_claim_evidence_footer_verification_contract": {
      "artifact_hash": "93fcd1de70efa8755f0cf8c7dabd5d906013569f291b93f64fcf15283e67f596",
      "hash_reproducible": true,
      "level": "RDLLM-L184",
      "minimum_level": "RDLLM-L184",
      "payload_hash": "93fcd1de70efa8755f0cf8c7dabd5d906013569f291b93f64fcf15283e67f596",
      "present": true,
      "ready": true,
      "status": "ready"
    },
    "universal_provider_meter_normalization_contract": {
      "artifact_hash": "715adf2aa9426862b313b7075dc8d2409e848a5f212248c852ff971d9644a6a2",
      "hash_reproducible": true,
      "level": "RDLLM-L185",
      "minimum_level": "RDLLM-L185",
      "payload_hash": "715adf2aa9426862b313b7075dc8d2409e848a5f212248c852ff971d9644a6a2",
      "present": true,
      "ready": true,
      "status": "ready"
    },
    "universal_runtime_route_binding_contract": {
      "artifact_hash": "d2991beb552b0c519e46e454ff4caee8809ed8881686cca7a831ee3f2bd2daf7",
      "hash_reproducible": true,
      "level": "RDLLM-L179",
      "minimum_level": "RDLLM-L179",
      "payload_hash": "d2991beb552b0c519e46e454ff4caee8809ed8881686cca7a831ee3f2bd2daf7",
      "present": true,
      "ready": true,
      "status": "ready"
    }
  },
  "checks": {
    "claim_evidence_footer_l184_ready": true,
    "contract_signed": true,
    "negative_response_state_fixtures_reject": true,
    "normalized_response_state_field_rows_complete": true,
    "provider_meter_normalization_l185_ready": true,
    "provider_response_state_surface_rows_complete": true,
    "release_gate_rows_complete": true,
    "route_response_state_rows_complete": true,
    "runtime_route_binding_l179_ready": true
  },
  "coverage": {
    "incomplete_negative_response_state_failures": [],
    "incomplete_normalized_response_state_fields": [],
    "incomplete_provider_response_state_surfaces": [],
    "incomplete_release_gate_rows": [],
    "incomplete_route_response_state_rows": [],
    "mismatched_release_gate_rows": [],
    "mismatched_route_response_state_rows": [],
    "missing_negative_response_state_failures": [],
    "missing_normalized_response_state_fields": [],
    "missing_provider_response_state_surfaces": [],
    "missing_release_gate_rows": [],
    "missing_route_response_state_rows": [],
    "route_ids": [
      "reference-route:cloud_hosted_provider:fine_tuning:13",
      "reference-route:cloud_hosted_provider:reasoning:1",
      "reference-route:embedding_provider:tool_calling_agent:10",
      "reference-route:enterprise_private_model:audio_speech:5",
      "reference-route:enterprise_private_model:gateway_router:17",
      "reference-route:fine_tuning_provider:batch_generation:11",
      "reference-route:foundation_provider:streaming:12",
      "reference-route:foundation_provider:text_chat:0",
      "reference-route:hosted_open_weight_service:image_generation:4",
      "reference-route:hosted_open_weight_service:local_inference:16",
      "reference-route:local_runtime:video_generation:6",
      "reference-route:model_marketplace:long_context:2",
      "reference-route:model_marketplace:retrieval_augmented:14",
      "reference-route:multimodal_media_provider:code_generation:9",
      "reference-route:open_weight_registry:embedding:7",
      "reference-route:regional_sovereign_provider:reranking:8",
      "reference-route:router_or_gateway:multimodal_vision:3",
      "reference-route:router_or_gateway:safety_moderation:15"
    ]
  },
  "created_at": "2026-06-03T00:00:00Z",
  "evidence_roots": {
    "combined_response_state_root": "cbac3eda7c7844f4be2fb840597c824d3c2e79e3d3464e7012e7dabc2248823f",
    "negative_response_state_root": "2ecd28dd360965d29942241f2fda54d942b755dd85e0e13df72e3227f2da83f7",
    "normalized_response_state_field_root": "ad409408165fc18a1b5147f37b22f1b75110c0432da9da7aa29aa6fa1845728b",
    "provider_response_state_surface_root": "e92b679d47588bc2ad913b0c4220de2480558920146187212ba4f984ca9b8a90",
    "release_gate_root": "b010ab943faa19428693aa63b9891a24a0af5d777b2d130f220e4cc2835600fc",
    "route_response_state_root": "b86db16cd45b333a850e01394b222a19b5974ffd1e536856d21f126ba0e2a1ab"
  },
  "issuer": "rdllm-local-demo",
  "negative_response_state_rows": {
    "content_filter_finish_ignored": {
      "creator_settlement_held": true,
      "expected_reject": true,
      "fixture_hash": "ac8047401ca02892f15b10614d6269b420c2fcdcd8d9f189b473089d57bbd2d1",
      "footer_reliance_blocked": true,
      "no_private_payloads": true,
      "observed_reject": true,
      "public_status_marked_failed": true,
      "response_release_blocked": true,
      "verifier_hash": "7bf0f5968f6f374558c6e08280cafaa2a762b367d38ffb5eb1d9f62d73a8cb29"
    },
    "fallback_response_without_state_reset": {
      "creator_settlement_held": true,
      "expected_reject": true,
      "fixture_hash": "90fb1f9fe8ab5d54999855e33edf18585a9fa3e73c30ef62cd8406185d0365a6",
      "footer_reliance_blocked": true,
      "no_private_payloads": true,
      "observed_reject": true,
      "public_status_marked_failed": true,
      "response_release_blocked": true,
      "verifier_hash": "192f5d6ed483756ac951521811d63fbafe024adc8d826702e8f9cdde576372fe"
    },
    "guardrail_intervention_hidden": {
      "creator_settlement_held": true,
      "expected_reject": true,
      "fixture_hash": "250362199efaebd123f9bd9643a2bfeaa191928a1d269aa218e57e1b9c8b822b",
      "footer_reliance_blocked": true,
      "no_private_payloads": true,
      "observed_reject": true,
      "public_status_marked_failed": true,
      "response_release_blocked": true,
      "verifier_hash": "c312ff06d7ec962201d882ed36eb05a518a7c796f70eee13b632286cd791d5d2"
    },
    "incomplete_stream_committed": {
      "creator_settlement_held": true,
      "expected_reject": true,
      "fixture_hash": "fd75c7a7fa80e341831791ff7d79a6b7abb4594017e4d3f351046e9b2cd60f8b",
      "footer_reliance_blocked": true,
      "no_private_payloads": true,
      "observed_reject": true,
      "public_status_marked_failed": true,
      "response_release_blocked": true,
      "verifier_hash": "564047a7202594cb33e12568ad9a0921f3002d56b3fa9218800b4a50c2a11c2e"
    },
    "local_runtime_crash_rendered_answer": {
      "creator_settlement_held": true,
      "expected_reject": true,
      "fixture_hash": "5101982de514cdf47cd9e5eef234e9cd8914196539de2c396d5270742efd7ca5",
      "footer_reliance_blocked": true,
      "no_private_payloads": true,
      "observed_reject": true,
      "public_status_marked_failed": true,
      "response_release_blocked": true,
      "verifier_hash": "6e257d79640456541279298412d106ae3465fe65ae8378d03a5ab9061562dec6"
    },
    "max_tokens_truncation_treated_complete": {
      "creator_settlement_held": true,
      "expected_reject": true,
      "fixture_hash": "039af8dc57ad2d62909a2510c8ce19c6ee93e80f2233b8c3c7bedc7ff80d5c34",
      "footer_reliance_blocked": true,
      "no_private_payloads": true,
      "observed_reject": true,
      "public_status_marked_failed": true,
      "response_release_blocked": true,
      "verifier_hash": "c358290589f13a788f8b443e46a10521ea5b7c99445785a5487afa6bd7f93588"
    },
    "moderation_error_not_user_visible": {
      "creator_settlement_held": true,
      "expected_reject": true,
      "fixture_hash": "d4ddf26cce9271a944012469c87885e25510d3cb00eec874634788e3f094a348",
      "footer_reliance_blocked": true,
      "no_private_payloads": true,
      "observed_reject": true,
      "public_status_marked_failed": true,
      "response_release_blocked": true,
      "verifier_hash": "99c79b798ac38a4e9744f7fb0d1c17ba1239f8dd6e84bd3ea270950856458925"
    },
    "native_finish_reason_dropped": {
      "creator_settlement_held": true,
      "expected_reject": true,
      "fixture_hash": "6bcd0ddcd790ff94218e70534281407ffbbab53b228c1a7c4f6260eb2635da6f",
      "footer_reliance_blocked": true,
      "no_private_payloads": true,
      "observed_reject": true,
      "public_status_marked_failed": true,
      "response_release_blocked": true,
      "verifier_hash": "f0c8c421ce73271d86bf702eb727a8b36bb5cb5ea531468c93b60f5cbc17430e"
    },
    "private_safety_payload_leak": {
      "creator_settlement_held": true,
      "expected_reject": true,
      "fixture_hash": "47d55392a947b6756c354490e16ff0d3e2168ff20a0937ee8f1314db64033743",
      "footer_reliance_blocked": true,
      "no_private_payloads": true,
      "observed_reject": true,
      "public_status_marked_failed": true,
      "response_release_blocked": true,
      "verifier_hash": "729a540be3df5580126a77b2f24b117a49e305a4923b0ebc30d0f1b9e6d7cbd3"
    },
    "prompt_block_without_prompt_feedback": {
      "creator_settlement_held": true,
      "expected_reject": true,
      "fixture_hash": "e75b60c0c9901b243bb8802d8d1711780fa85d8ec4ab3811698a211698927ec7",
      "footer_reliance_blocked": true,
      "no_private_payloads": true,
      "observed_reject": true,
      "public_status_marked_failed": true,
      "response_release_blocked": true,
      "verifier_hash": "2cd0b4e98eab9901dec34c5ad0c35e9f653ceda578a49ff732929a72c6b21b8f"
    },
    "provider_error_treated_as_model_answer": {
      "creator_settlement_held": true,
      "expected_reject": true,
      "fixture_hash": "914347dda8e095806f12dc0c88b994013e0f89b51f401896c39fb326749f40a1",
      "footer_reliance_blocked": true,
      "no_private_payloads": true,
      "observed_reject": true,
      "public_status_marked_failed": true,
      "response_release_blocked": true,
      "verifier_hash": "84e5f3fc522b4e5e4dd6d7dac50e327c698c7a52267e42b6820ca52bd743d6fb"
    },
    "rate_limit_error_rendered_answer": {
      "creator_settlement_held": true,
      "expected_reject": true,
      "fixture_hash": "d60daf5bcfbbea0bd16e32820fc5ae32355eab989f779fab5768b06ce4bb09ab",
      "footer_reliance_blocked": true,
      "no_private_payloads": true,
      "observed_reject": true,
      "public_status_marked_failed": true,
      "response_release_blocked": true,